namespace,name,def
biological_process,"DNA-templated transcription, initiation","""Any process involved in the assembly of the RNA polymerase preinitiation complex (PIC) at the core promoter region of a DNA template, resulting in the subsequent synthesis of RNA from that promoter. The initiation phase includes PIC assembly and the formation of the first few bonds in the RNA chain, including abortive initiation, which occurs when the first few nucleotides are repeatedly synthesized and then released. The initiation phase ends just before and does not include promoter clearance, or release, which is the transition between the initiation and elongation phases of transcription."" [GOC:jid, GOC:txnOH, PMID:18280161]"
biological_process,regulation of pyruvate dehydrogenase activity,"""Any process that modulates the frequency, rate or extent of pyruvate dehydrogenase activity."" [GO_REF:0000059, GOC:dph, GOC:TermGenie, PMID:25525879]"
biological_process,response to sorbitol,"""Any process that results in a change in state or activity of a cell or an organism (in terms of movement, secretion, enzyme production, gene expression, etc.) as a result of a sorbitol stimulus."" [CHEBI:30911, GOC:mah]"
biological_process,embryo implantation,"""Attachment of the blastocyst to the uterine lining."" [GOC:isa_complete, http://www.medterms.com]"
molecular_function,glucocorticoid receptor binding,"""Interacting selectively and non-covalently with a glucocorticoid receptor."" [GOC:bf]"
biological_process,hepatocyte growth factor receptor signaling pathway,"""The series of molecular signals generated as a consequence of the hepatocyte growth factor receptor binding to one of its physiological ligands."" [GOC:ceb]"
biological_process,regulation of chromatin silencing,"""Any process that affects the rate, extent or location of chromatin silencing."" [GOC:mah]"
biological_process,positive regulation of isotype switching to IgA isotypes,"""Any process that activates or increases the frequency, rate or extent of isotype switching to IgA isotypes."" [GOC:jid]"
biological_process,peptidyl-lysine deacetylation,"""The removal of an acetyl group from an acetylated lysine residue in a peptide or protein."" [GOC:BHF, GOC:mah]"
biological_process,mitotic DNA replication checkpoint,"""A cell cycle checkpoint that acts during a mitotic cell cycle and prevents the initiation of mitosis until DNA replication is complete, thereby ensuring that progeny inherit a full complement of the genome."" [GOC:mtg_cell_cycle]"
biological_process,epidermis morphogenesis,"""The process in which the anatomical structures of the epidermis are generated and organized. The epidermis is the outer epithelial layer of an animal, it may be a single layer that produces an extracellular material (e.g. the cuticle of arthropods) or a complex stratified squamous epithelium, as in the case of many vertebrate species."" [GOC:jid, UBERON:0001003]"
molecular_function,P-TEFb complex binding,"""Interacting selectively and non-covalently with the P-TEFb complex."" [GOC:pga, PMID:18391197]"
biological_process,endothelial cell migration,"""The orderly movement of an endothelial cell into the extracellular matrix to form an endothelium."" [GOC:go_curators]"
biological_process,response to methylglyoxal,"""Any process that results in a change in state or activity of a cell or an organism (in terms of movement, secretion, enzyme production, gene expression, etc.) as a result of a methylglyoxal stimulus. Methylglyoxal is a 2-oxoaldehyde derived from propanal."" [GOC:ai]"
biological_process,positive regulation blood vessel branching,"""Any process that activates or increases the frequency, rate or extent of blood vessel branching."" [GO_REF:0000058, GOC:BHF, GOC:BHF_telomere, GOC:nc, GOC:TermGenie, PMID:23201774]"
molecular_function,FK506 binding,"""Interacting selectively and non-covalently with the 23-membered macrolide lactone FK506."" [GOC:jl]"
biological_process,lymphocyte proliferation,"""The expansion of a lymphocyte population by cell division."" [GOC:ai]"
biological_process,positive regulation of epithelial to mesenchymal transition,"""Any process that increases the rate, frequency, or extent of epithelial to mesenchymal transition. Epithelial to mesenchymal transition is where an epithelial cell loses apical/basolateral polarity, severs intercellular adhesive junctions, degrades basement membrane components and becomes a migratory mesenchymal cell."" [GOC:BHF, GOC:dph, GOC:tb]"
biological_process,regulation of protein localization to plasma membrane,"""Any process that modulates the frequency, rate or extent of protein localization to plasma membrane."" [GO_REF:0000058, GOC:BHF, GOC:rl, GOC:TermGenie, PMID:11602640]"
biological_process,cellular response to cocaine,"""Any process that results in a change in state or activity of a cell (in terms of movement, secretion, enzyme production, gene expression, etc.) as a result of a cocaine stimulus. Cocaine is a crystalline alkaloid obtained from the leaves of the coca plant."" [GOC:mah]"
biological_process,regulation of histone H3-K27 acetylation,"""Any process that modulates the frequency, rate or extent of histone H3-K27 acetylation."" [GOC:BHF, GOC:TermGenie]"
biological_process,response to ionizing radiation,"""Any process that results in a change in state or activity of a cell or an organism (in terms of movement, secretion, enzyme production, gene expression, etc.) as a result of a ionizing radiation stimulus. Ionizing radiation is radiation with sufficient energy to remove electrons from atoms and may arise from spontaneous decay of unstable isotopes, resulting in alpha and beta particles and gamma rays. Ionizing radiation also includes X-rays."" [PMID:12509526]"
biological_process,ribosome biogenesis,"""A cellular process that results in the biosynthesis of constituent macromolecules, assembly, and arrangement of constituent parts of ribosome subunits; includes transport to the sites of protein synthesis."" [GOC:ma, PMID:26404467, Wikipedia:Ribosome_biogenesis]"
biological_process,negative regulation by host of viral transcription,"""Any process in which a host organism stops, prevents, or reduces the frequency, rate or extent of viral transcription."" [GOC:jl]"
cellular_component,BRCA1-A complex,"""A protein complex that contains the BRCA1-BARD1 heterodimer, RAP80/UIMC1, BRCC3/BRCC36, BRE/BRCC45, FAM175A/CCDC98/Abraxas and MERIT40/NBA1, and specifically recognizes and binds K63-linked polyubiquitin chains present on histone H2A and H2AX at DNA damage sites."" [GOC:mah, PMID:19261749]"
biological_process,cholesterol metabolic process,"""The chemical reactions and pathways involving cholesterol, cholest-5-en-3 beta-ol, the principal sterol of vertebrates and the precursor of many steroids, including bile acids and steroid hormones. It is a component of the plasma membrane lipid bilayer and of plasma lipoproteins and can be found in all animal tissues."" [ISBN:0198506732]"
cellular_component,postsynaptic actin cytoskeleton,"""The actin cytoskeleton that is part of a postsynapse"" [GOC:dos]"
biological_process,regulation of norepinephrine uptake,"""Any process that modulates the frequency, rate or extent of the directed movement of the neurotransmitter norepinephrine into a cell."" [GOC:ai]"
molecular_function,histone methyltransferase activity (H4-R3 specific),"""Catalysis of the reaction: S-adenosyl-L-methionine + (histone H4)-arginine (position 3) = S-adenosyl-L-homocysteine + (histone H4)-N-methyl-arginine (position 3). This reaction is the addition of a methyl group to arginine at position 3 of histone H4."" [EC:2.1.1.125, GOC:mah, PMID:17898714]"
biological_process,protein-containing complex localization,"""A localization process that acts on a protein complex; the complex is transported to, or maintained in, a specific location."" [GOC:mah]"
biological_process,negative regulation of RNA polymerase II regulatory region sequence-specific DNA binding,"""Any process that stops, prevents or reduces the frequency, rate or extent of RNA polymerase II regulatory region sequence-specific DNA binding."" [GO_REF:0000059, GOC:dph, GOC:krc, GOC:TermGenie, PMID:20026326]"
biological_process,regulation of growth plate cartilage chondrocyte proliferation,"""Any process that modulates the rate, frequency, or extent of the multiplication or reproduction of chondrocytes in a growing endochondral bone, resulting in the expansion of a cell population."" [GOC:ascb_2009, GOC:dph, GOC:tb]"
molecular_function,DNA-binding transcription factor activity,"""A protein or a member of a complex that interacts selectively and non-covalently with a specific DNA sequence (sometimes referred to as a motif) within the regulatory region of a gene to modulate transcription. Regulatory regions include promoters (proximal and distal) and enhancers. Genes are transcriptional units, and include bacterial operons."" [GOC:txnOH-2018]"
biological_process,cranial nerve development,"""The process whose specific outcome is the progression of the cranial nerves over time, from its formation to the mature structure. The cranial nerves are composed of twelve pairs of nerves that emanate from the nervous tissue of the hindbrain. These nerves are sensory, motor, or mixed in nature, and provide the motor and general sensory innervation of the head, neck and viscera. They mediate vision, hearing, olfaction and taste and carry the parasympathetic innervation of the autonomic ganglia that control visceral functions."" [GO_REF:0000021, GOC:cls, GOC:dgh, GOC:dph, GOC:jid, GOC:mtg_15jun06, ISBN:0838580343]"
biological_process,positive regulation of proteasomal ubiquitin-dependent protein catabolic process involved in cellular response to hypoxia,"""Any positive regulation of proteasomal ubiquitin-dependent protein catabolic process that is involved in a cellular response to hypoxia."" [GOC:mah]"
biological_process,regulation of neurogenesis,"""Any process that modulates the frequency, rate or extent of neurogenesis, the generation of cells in the nervous system."" [GOC:ai]"
biological_process,regulation of histone H3-K9 methylation,"""Any process that modulates the frequency, rate or extent of the covalent addition of a methyl group to the lysine at position 9 of histone H3."" [GOC:ai]"
molecular_function,protein-arginine omega-N asymmetric methyltransferase activity,"""Catalysis of the addition of a second methyl group to methylated peptidyl-arginine. Methylation is on the same terminal nitrogen (omega nitrogen) residue that was previously methylated, resulting in asymmetrical peptidyl-N(omega),N(omega)-dimethylated arginine residues."" [EC:2.1.1.319, PMID:14705965, RESID:AA0068, RESID:AA0069]"
biological_process,microtubule cytoskeleton organization involved in mitosis,"""Any microtubule cytoskeleton organization that is involved in mitosis."" [GO_REF:0000060, GOC:TermGenie, PMID:18799626]"
biological_process,humoral immune response,"""An immune response mediated through a body fluid."" [GOC:hb, ISBN:0198506732]"
biological_process,heart development,"""The process whose specific outcome is the progression of the heart over time, from its formation to the mature structure. The heart is a hollow, muscular organ, which, by contracting rhythmically, keeps up the circulation of the blood."" [GOC:jid, UBERON:0000948]"
biological_process,male meiotic nuclear division,"""A cell cycle process by which the cell nucleus divides as part of a meiotic cell cycle in the male germline."" [GOC:dph, GOC:mah, GOC:vw]"
biological_process,extracellular matrix organization,"""A process that is carried out at the cellular level which results in the assembly, arrangement of constituent parts, or disassembly of an extracellular matrix."" [GOC:mah]"
biological_process,sister chromatid cohesion,"""The cell cycle process in which the sister chromatids of a replicated chromosome become tethered to each other."" [GOC:jh, GOC:mah, ISBN:0815316194]"
cellular_component,Cdc73/Paf1 complex,"""A multiprotein complex that associates with RNA polymerase II and general RNA polymerase II transcription factor complexes and may be involved in both transcriptional initiation and elongation. In Saccharomyces the complex contains Paf1p, Cdc73p, Ctr9p, Rtf1p, and Leo1p."" [PMID:11884586]"
biological_process,pyrimidine dimer repair by nucleotide-excision repair,"""The repair of UV-induced T-T, C-T, and C-C dimers by the recognition and removal of the damaged DNA strand from the DNA helix as an oligonucleotide. The small gap left in the DNA helix is filled in by the sequential action of DNA polymerase and DNA ligase."" [GOC:elh]"
molecular_function,kinesin binding,"""Interacting selectively and non-covalently and stoichiometrically with kinesin, a member of a superfamily of microtubule-based motor proteins that perform force-generating tasks such as organelle transport and chromosome segregation."" [GOC:curators, PMID:8606779]"
biological_process,covalent chromatin modification,"""The alteration of DNA or protein in chromatin by the covalent addition or removal of chemical groups."" [GOC:mah, GOC:vw]"
cellular_component,rDNA heterochromatin,"""A region of heterochromatin located at the rDNA repeats in a chromosome."" [GOC:mah]"
biological_process,meiotic gene conversion,"""The cell cycle process in which genetic information is transferred from one helix to another. It often occurs in association with general genetic recombination events, and is believed to be a straightforward consequence of the mechanisms of general recombination and DNA repair. For example, meiosis might yield three copies of the maternal version of an allele and only one copy of the paternal allele, indicating that one of the two copies of the paternal allele has been changed to a copy of the maternal allele."" [ISBN:0815316194]"
biological_process,positive regulation of insulin-like growth factor receptor signaling pathway,"""Any process that increases the frequency, rate or extent of insulin-like growth factor receptor signaling."" [GOC:bf]"
biological_process,negative regulation of tumor necrosis factor production,"""Any process that stops, prevents, or reduces the frequency, rate, or extent of tumor necrosis factor production."" [GOC:mah]"
biological_process,positive regulation of vascular smooth muscle cell proliferation,"""Any process that activates or increases the frequency, rate or extent of vascular smooth muscle cell proliferation."" [GO_REF:0000058, GOC:TermGenie, PMID:23246467]"
biological_process,"mitochondrial electron transport, ubiquinol to cytochrome c","""The transfer of electrons from ubiquinol to cytochrome c that occurs during oxidative phosphorylation, mediated by the multisubunit enzyme known as complex III."" [ISBN:0716731363]"
biological_process,negative regulation of ATP biosynthetic process,"""Any process that stops, prevents or reduces the frequency, rate or extent of ATP biosynthetic process."" [GOC:obol]"
biological_process,peptidyl-histidine methylation,"""The methylation of peptidyl-L-histidine to form peptidyl-L-1'-methyl-L-histidine (otherwise known as tau-methylhistidine, tele-methylhistidine) or peptidyl-L-3'-methyl-L-histidine (otherwise known as pi-methylhistidine, pros-methylhistidine)."" [RESID:AA0073, RESID:AA0317]"
biological_process,regulation of phosphorylation,"""Any process that modulates the frequency, rate or extent of addition of phosphate groups into a molecule."" [GOC:jl]"
biological_process,regulation of peroxisome proliferator activated receptor signaling pathway,"""Any process that modulates the frequency, rate or extent of the peroxisome proliferator activated receptor signaling pathway."" [GOC:bf]"
biological_process,spliceosomal snRNP assembly,"""The aggregation, arrangement and bonding together of one or more snRNA and multiple protein components to form a ribonucleoprotein complex that is involved in formation of the spliceosome."" [GOC:krc, GOC:mah, ISBN:0879695897]"
biological_process,cardiolipin metabolic process,"""The chemical reactions and pathways involving cardiolipin, 1,3-bis(3-phosphatidyl)glycerol."" [CHEBI:28494, GOC:mah]"
biological_process,negative regulation of telomerase activity,"""Any process that stops or reduces the activity of the enzyme telomerase, which catalyzes of the reaction: deoxynucleoside triphosphate + DNA(n) = diphosphate + DNA(n+1)."" [GOC:ai]"
biological_process,positive regulation of mRNA 3'-end processing,"""Any process that activates or increases the frequency, rate or extent of mRNA 3'-end processing."" [GOC:mah]"
biological_process,germ cell development,"""The process whose specific outcome is the progression of an immature germ cell over time, from its formation to the mature structure (gamete). A germ cell is any reproductive cell in a multicellular organism."" [GOC:go_curators]"
biological_process,regulation of glucose metabolic process,"""Any process that modulates the rate, frequency or extent of glucose metabolism. Glucose metabolic processes are the chemical reactions and pathways involving glucose, the aldohexose gluco-hexose."" [GOC:BHF, GOC:tb]"
cellular_component,vacuole,"""A closed structure, found only in eukaryotic cells, that is completely surrounded by unit membrane and contains liquid material. Cells contain one or several vacuoles, that may have different functions from each other. Vacuoles have a diverse array of functions. They can act as a storage organelle for nutrients or waste products, as a degradative compartment, as a cost-effective way of increasing cell size, and as a homeostatic regulator controlling both turgor pressure and pH of the cytosol."" [GOC:mtg_sensu, ISBN:0198506732]"
cellular_component,Elongator holoenzyme complex,"""A heterohexameric protein complex that is involved in modification of wobble nucleosides in tRNA. The complex can associate physically with hyperphosphorylated RNA polymerase II; it contains two discrete heterotrimeric subcomplexes."" [GOC:bhm, GOC:jh, GOC:mah, GOC:vw, PMID:11435442, PMID:11689709, PMID:15769872, PMID:17018299, PMID:18755837, PMID:23165209]"
molecular_function,transcription corepressor activity,"""A protein or a member of a complex that interacts specifically and non-covalently with a DNA-bound DNA-binding transcription factor to repress the transcription of specific genes. Corepressors often act by altering chromatin structure and modifications. For example, one class of transcription coregulators modifies chromatin structure through covalent modification of histones. A second ATP-dependent class modifies the conformation of chromatin. A third class occludes DNA-binding transcription factor protein-protein interaction domains. A fourth class of corepressors prevents interactions of DNA bound DNA-binding transcription factor with coactivators."" [GOC:txnOH-2018, PMID:10213677, PMID:16858867]"
molecular_function,acetyltransferase activity,"""Catalysis of the transfer of an acetyl group to an acceptor molecule."" [GOC:ai]"
biological_process,endodermal cell differentiation,"""The process in which a relatively unspecialized cell acquires the specialized features of an endoderm cell, a cell of the inner of the three germ layers of the embryo."" [CL:0000223, GOC:yaf, PMID:17624332]"
biological_process,protein destabilization,"""Any process that decreases the stability of a protein, making it more vulnerable to degradative processes or aggregation."" [GOC:mah]"
biological_process,embryonic skeletal system morphogenesis,"""The process in which the anatomical structures of the skeleton are generated and organized during the embryonic phase."" [GOC:dph, GOC:dsf, GOC:jid, GOC:tb, PMID:16049113]"
cellular_component,mitotic spindle midzone,"""The area in the center of the anaphase spindle consisting of microtubules, microtubule bundling factors and kinesin motors where the spindle microtubules from opposite poles overlap in an antiparallel manner."" [GOC:mtg_cell_cycle, GOC:vw]"
biological_process,cellular response to leukemia inhibitory factor,"""Any process that results in a change in state or activity of a cell (in terms of movement, secretion, enzyme production, gene expression, etc.) as a result of a leukemia inhibitory factor stimulus."" [PMID:12801913]"
biological_process,liver morphogenesis,"""The process in which the anatomical structures of the liver are generated and organized."" [GOC:mah]"
biological_process,positive regulation of peptidyl-lysine acetylation,"""Any process that activates or increases the frequency, rate or extent of peptidyl-lysine acetylation."" [GOC:obol]"
biological_process,blood vessel development,"""The process whose specific outcome is the progression of a blood vessel over time, from its formation to the mature structure. The blood vessel is the vasculature carrying blood."" [GOC:hjd, UBERON:0001981]"
molecular_function,nuclear receptor transcription coactivator activity,"""The function of a transcription cofactor that activates transcription in conjuction with a ligand-dependent nuclear receptor from a RNA polymerase II promoter; does not bind DNA itself."" [GOC:dph, GOC:tb]"
biological_process,histone H3-R26 citrullination,"""The hydrolysis of peptidyl-arginine to form peptidyl-citrulline at position 26 in histone H3."" [GOC:als, PMID:22853951]"
biological_process,regulation of striated muscle cell differentiation,"""Any process that modulates the frequency, rate or extent of striated muscle cell differentiation."" [CL:0000737, GOC:ai]"
biological_process,fertilization,"""The union of gametes of opposite sexes during the process of sexual reproduction to form a zygote. It involves the fusion of the gametic nuclei (karyogamy) and cytoplasm (plasmogamy)."" [GOC:tb, ISBN:0198506732]"
biological_process,positive regulation of dendrite extension,"""Any process that activates or increases the frequency, rate or extent of dendrite extension."" [GO_REF:0000058, GOC:pad, GOC:PARL, GOC:TermGenie, PMID:24898855]"
biological_process,neural tube development,"""The process whose specific outcome is the progression of the neural tube over time, from its formation to the mature structure. The mature structure of the neural tube exists when the tube has been segmented into the forebrain, midbrain, hindbrain and spinal cord regions. In addition neural crest has budded away from the epithelium."" [GO_REF:0000021, GOC:cls, GOC:dgh, GOC:dph, GOC:jid, GOC:mtg_15jun06]"
biological_process,negative regulation of MAPK cascade,"""Any process that stops, prevents, or reduces the frequency, rate or extent of signal transduction mediated by the MAPKKK cascade."" [GOC:go_curators]"
biological_process,histone H4-K16 acetylation,"""The modification of histone H4 by the addition of an acetyl group to a lysine residue at position 16 of the histone."" [GOC:jl]"
molecular_function,acetylputrescine deacetylase activity,"""Catalysis of the reaction: N-acetylputrescine + H(2)O = acetate + putrescine."" [EC:3.5.1.62, RHEA:23412]"
biological_process,response to tetrachloromethane,"""Any process that results in a change in state or activity of a cell or an organism (in terms of movement, secretion, enzyme production, gene expression, etc.) as a result of a tetrachloromethane stimulus."" [GO_REF:0000071, GOC:TermGenie, PMID:7852267]"
biological_process,negative regulation of epidermal cell differentiation,"""Any process that stops, prevents, or reduces the frequency, rate or extent of epidermal cell differentiation."" [GOC:go_curators]"
biological_process,negative regulation of protein kinase B signaling,"""Any process that stops, prevents, or reduces the frequency, rate or extent of protein kinase B signaling, a series of reactions mediated by the intracellular serine/threonine kinase protein kinase B."" [GOC:ai]"
biological_process,histone H3-R26 methylation,"""The modification of histone H3 by addition of a methyl group to arginine at position 26 of the histone."" [GOC:mah]"
cellular_component,mitochondrial inner membrane,"""The inner, i.e. lumen-facing, lipid bilayer of the mitochondrial envelope. It is highly folded to form cristae."" [GOC:ai]"
biological_process,immunoglobulin production,"""The appearance of immunoglobulin due to biosynthesis or secretion following a cellular stimulus, resulting in an increase in its intracellular or extracellular levels."" [GOC:add, ISBN:0781735149]"
biological_process,cardiovascular system development,"""The process whose specific outcome is the progression of the cardiovascular system over time, from its formation to the mature structure. The cardiovascular system is the anatomical system that has as its parts the heart and blood vessels."" [GOC:mah, UBERON:0004535]"
biological_process,DNA replication-independent nucleosome organization,"""The formation or destruction of chromatin structures, occurring outside the context of DNA replication."" [GOC:mah, PMID:17510629]"
molecular_function,aminopeptidase activity,"""Catalysis of the hydrolysis of N-terminal amino acid residues from in a polypeptide chain."" [GOC:jl, ISBN:0198506732]"
biological_process,cell surface receptor signaling pathway,"""A series of molecular signals initiated by activation of a receptor on the surface of a cell. The pathway begins with binding of an extracellular ligand to a cell surface receptor, or for receptors that signal in the absence of a ligand, by ligand-withdrawal or the activity of a constitutively active receptor. The pathway ends with regulation of a downstream cellular process, e.g. transcription."" [GOC:bf, GOC:mah, GOC:pr, GOC:signaling]"
biological_process,macrophage differentiation,"""The process in which a relatively unspecialized monocyte acquires the specialized features of a macrophage."" [GOC:add, ISBN:0781735149]"
