namespace,name,def
biological_process,interleukin-6 production,"""The appearance of interleukin-6 due to biosynthesis or secretion following a cellular stimulus, resulting in an increase in its intracellular or extracellular levels."" [GOC:mah]"
biological_process,positive regulation of protein deacetylation,"""Any process that increases the rate, frequency, or extent of protein deacetylation, the removal of an acetyl group from a protein amino acid. An acetyl group is CH3CO-, derived from acetic [ethanoic] acid."" [GOC:ecd, PMID:20027304]"
biological_process,intracellular protein transport,"""The directed movement of proteins in a cell, including the movement of proteins between specific compartments or structures within a cell, such as organelles of a eukaryotic cell."" [GOC:mah]"
biological_process,regulation of myotube differentiation,"""Any process that modulates the frequency, rate or extent of myotube differentiation. Myotube differentiation is the process in which a relatively unspecialized cell acquires specialized features of a myotube cell. Myotubes are multinucleated cells that are formed when proliferating myoblasts exit the cell cycle, differentiate and fuse."" [GOC:dph, GOC:tb]"
biological_process,skeletal muscle satellite cell maintenance involved in skeletal muscle regeneration,"""Any process by which the number of skeletal muscle satellite cells in a skeletal muscle is maintained during muscle regeneration. There are at least three mechanisms by which this is achieved. Skeletal muscle satellite stem cell asymmetric division ensures satellite stem cell numbers are kept constant. Symmetric division of these cells amplifies the number of skeletal muscle satellite stem cells.  Some adult skeletal muscle myoblasts (descendants of activated satellite cells) can develop back into quiescent satellite cells, replenishing the overall pool of satellite cells."" [GOC:dph, GOC:ef, GOC:mtg_muscle, GOC:tb, PMID:23303905]"
biological_process,response to estrogen,"""Any process that results in a change in state or activity of a cell or an organism (in terms of movement, secretion, enzyme production, gene expression, etc.) as a result of stimulus by an estrogen, C18 steroid hormones that can stimulate the development of female sexual characteristics."" [GOC:jl, ISBN:0198506732]"
biological_process,regulation of stem cell proliferation,"""Any process that modulates the frequency, rate or extent of stem cell proliferation. A stem cell is a cell that retains the ability to divide and proliferate throughout life to provide progenitor cells that can differentiate into specialized cells."" [GOC:mtg_kidney_jan10]"
molecular_function,ubiquitin conjugating enzyme activity,"""Isoenergetic transfer of ubiquitin from one protein to another via the reaction X-ubiquitin + Y -> Y-ubiquitin + X, where both the X-ubiquitin and Y-ubiquitin linkages are thioester bonds between the C-terminal glycine of ubiquitin and a sulfhydryl side group of a cysteine residue."" [GOC:BioGRID, GOC:dph]"
cellular_component,spindle microtubule,"""Any microtubule that is part of a mitotic or meiotic spindle; anchored at one spindle pole."" [ISBN:0815316194]"
biological_process,positive regulation of muscle cell differentiation,"""Any process that activates or increases the frequency, rate or extent of muscle cell differentiation."" [CL:0000187, GOC:ai]"
biological_process,regulation of gene expression,"""Any process that modulates the frequency, rate or extent of gene expression. Gene expression is the process in which a gene's coding sequence is converted into a mature gene product or products (proteins or RNA). This includes the production of an RNA transcript as well as any processing to produce a mature RNA product or an mRNA or circRNA (for protein-coding genes) and the translation of that mRNA or circRNA into protein. Protein maturation is included when required to form an active form of a product from an inactive precursor form."" [GOC:dph, GOC:tb]"
biological_process,response to gamma radiation,"""Any process that results in a change in state or activity of a cell or an organism (in terms of movement, secretion, enzyme production, gene expression, etc.) as a result of a gamma radiation stimulus. Gamma radiation is a form of electromagnetic radiation (EMR) or light emission of a specific frequency produced from sub-atomic particle interaction, such as electron-positron annihilation and radioactive decay. Gamma rays are generally characterized as EMR having the highest frequency and energy, and also the shortest wavelength, within the electromagnetic radiation spectrum."" [GOC:tair_curators, Wikipedia:Gamma_ray]"
cellular_component,filopodium,"""Thin, stiff, actin-based protrusion extended by the leading edge of a motile cell such as a crawling fibroblast or amoeba, or an axonal or dendritic growth cone, or a dendritic shaft."" [GOC:mah, GOC:pr, ISBN:0815316194]"
biological_process,blastocyst formation,"""The initial formation of a blastocyst from a solid ball of cells known as a morula."" [GOC:dph, ISBN:0124020607, ISBN:0198542771]"
molecular_function,transcription regulatory region sequence-specific DNA binding,"""Interacting selectively and non-covalently with a specific sequence of DNA that is part of a regulatory region that controls transcription of that section of the DNA. The transcribed region might be described as a gene, cistron, or operon."" [GOC:txnOH]"
biological_process,maternal placenta development,"""Maternally driven process whose specific outcome is the progression of the placenta over time, from its formation to the mature structure. The placenta is an organ of metabolic interchange between fetus and mother, partly of embryonic origin and partly of maternal origin."" [GOC:add, ISBN:068340007X]"
biological_process,regulation of receptor signaling pathway via JAK-STAT,"""Any process that modulates the frequency, rate or extent of receptor signaling via JAK-STAT."" [GOC:bf]"
biological_process,intracellular distribution of mitochondria,"""Any process that establishes the spatial arrangement of mitochondria within the cell."" [GOC:jid]"
biological_process,liver regeneration,"""The regrowth of lost or destroyed liver."" [GOC:gap, PMID:19447520]"
biological_process,hemoglobin metabolic process,"""The chemical reactions and pathways involving hemoglobin, including its uptake and utilization."" [GOC:go_curators, GOC:jl]"
cellular_component,cell projection,"""A prolongation or process extending from a cell, e.g. a flagellum or axon."" [GOC:jl, http://www.cogsci.princeton.edu/~wn/]"
molecular_function,RNA polymerase II complex recruiting activity,"""Interacting selectively and non-covalently with an RNA polymerase II (Pol II) complex, typically composed of twelve subunits, and with another protein, macromolecule, or complex, permitting those molecules to function in a coordinated way in order to facilitate the aggregation, arrangement and bonding together of proteins on an RNA polymerase II promoter DNA to form the transcriptional preinitiation complex (PIC), the formation of which is a prerequisite for transcription by RNA polymerase."" [GOC:txnOH, PMID:16858867]"
molecular_function,protein kinase B binding,"""Interacting selectively and non-covalently with protein kinase B, an intracellular kinase that is important in regulating glucose metabolism."" [GOC:jl, http://www.heartandmetabolism.org/]"
biological_process,keratinocyte differentiation,"""The process in which a relatively unspecialized cell acquires specialized features of a keratinocyte."" [GOC:dph, GOC:mah, GOC:sdb_2009, GOC:tb]"
biological_process,in utero embryonic development,"""The process whose specific outcome is the progression of the embryo in the uterus over time, from formation of the zygote in the oviduct, to birth. An example of this process is found in Mus musculus."" [GOC:go_curators, GOC:mtg_sensu]"
biological_process,response to type I interferon,"""Any process that results in a change in state or activity of a cell or an organism (in terms of movement, secretion, enzyme production, gene expression, etc.) as a result of a type I interferon stimulus. Type I interferons include the interferon-alpha, beta, delta, episilon, zeta, kappa, tau, and omega gene families."" [GOC:add, ISBN:0126896631, PMID:15546383, PMID:16681834]"
cellular_component,"chromosome, centromeric region","""The region of a chromosome that includes the centromeric DNA and associated proteins. In monocentric chromosomes, this region corresponds to a single area of the chromosome, whereas in holocentric chromosomes, it is evenly distributed along the chromosome."" [GOC:cjm, GOC:elh, GOC:kmv, GOC:pr]"
biological_process,mitochondrion organization,"""A process that is carried out at the cellular level which results in the assembly, arrangement of constituent parts, or disassembly of a mitochondrion; includes mitochondrial morphogenesis and distribution, and replication of the mitochondrial genome as well as synthesis of new mitochondrial components."" [GOC:dph, GOC:jl, GOC:mah, GOC:sgd_curators, PMID:9786946]"
biological_process,negative regulation of neurogenesis,"""Any process that stops, prevents, or reduces the frequency, rate or extent of neurogenesis, the generation of cells within the nervous system."" [GOC:ai]"
biological_process,positive regulation of cell death,"""Any process that increases the rate or frequency of cell death. Cell death is the specific activation or halting of processes within a cell so that its vital functions markedly cease, rather than simply deteriorating gradually over time, which culminates in cell death."" [GOC:dph, GOC:tb]"
biological_process,negative regulation of DNA replication,"""Any process that stops, prevents, or reduces the frequency, rate or extent of DNA replication."" [GOC:go_curators]"
biological_process,excitatory postsynaptic potential,"""A process that leads to a temporary increase in postsynaptic potential due to the flow of positively charged ions into the postsynaptic cell. The flow of ions that causes an EPSP is an excitatory postsynaptic current (EPSC) and makes it easier for the neuron to fire an action potential."" [GOC:dph, GOC:ef]"
biological_process,negative regulation of mitochondrial fission,"""Any process that decreases the rate, frequency or extent of mitochondrial fission. Mitochondrial fission is the division of a mitochondrion within a cell to form two or more separate mitochondrial compartments."" [GOC:sl, GOC:tb]"
molecular_function,modified amino acid binding,"""Interacting selectively and non-covalently with a modified amino acid."" [CHEBI:83821, GOC:mah]"
biological_process,nucleotide-excision repair,"""A DNA repair process in which a small region of the strand surrounding the damage is removed from the DNA helix as an oligonucleotide. The small gap left in the DNA helix is filled in by the sequential action of DNA polymerase and DNA ligase. Nucleotide excision repair recognizes a wide range of substrates, including damage caused by UV irradiation (pyrimidine dimers and 6-4 photoproducts) and chemicals (intrastrand cross-links and bulky adducts)."" [PMID:10197977]"
biological_process,regulation of NK T cell differentiation,"""Any process that modulates the frequency, rate or extent of natural killer T cell differentiation."" [ISBN:0781735149, PMID:12154375, PMID:9133426]"
biological_process,neuron fate specification,"""The process in which a cell becomes capable of differentiating autonomously into a neuron in an environment that is neutral with respect to the developmental pathway. Upon specification, the cell fate can be reversed."" [GOC:dph]"
cellular_component,fibrillar center,"""A structure found most metazoan nucleoli, but not usually found in lower eukaryotes; surrounded by the dense fibrillar component; the zone of transcription from multiple copies of the pre-rRNA genes is in the border region between these two structures."" [PMID:10754561]"
biological_process,positive regulation of CREB transcription factor activity,"""Any process that activates or increases the frequency, rate or extent of activity of the transcription factor CREB."" [GOC:dph, GOC:ecd, GOC:tb]"
biological_process,histone citrullination,"""The hydrolysis of peptidyl-arginine to form peptidyl-citrulline on a histone protein."" [GOC:als, PMID:22853951, PMID:23175390]"
biological_process,positive regulation of immature T cell proliferation in thymus,"""Any process that activates or increases the frequency, rate or extent of immature T cell proliferation in the thymus."" [GOC:add, GOC:mah]"
biological_process,peptidyl-lysine acetylation,"""The acetylation of peptidyl-lysine."" [GOC:mah]"
biological_process,protein quality control for misfolded or incompletely synthesized proteins,"""The chemical reactions and pathways resulting in the breakdown of misfolded or attenuated proteins."" [GOC:jl]"
molecular_function,pyrimidine-specific mismatch base pair DNA N-glycosylase activity,"""Catalysis of the removal of mismatched pyrimidine bases in DNA. Enzymes with this activity recognize and remove pyrimidines present in mismatches by cleaving the N-C1' glycosidic bond between the target damaged DNA base and the deoxyribose sugar. The reaction releases a free base and leaves an apyrimidinic (AP) site."" [GOC:elh, PMID:9224623]"
molecular_function,nucleosomal DNA binding,"""Interacting selectively and non-covalently with the DNA portion of a nucleosome."" [GOC:mah]"
biological_process,cellular response to molecule of bacterial origin,"""Any process that results in a change in state or activity of a cell (in terms of movement, secretion, enzyme production, gene expression, etc.) as a result of a stimulus by molecules of bacterial origin such as peptides derived from bacterial flagellin."" [GOC:mah]"
biological_process,T cell differentiation in thymus,"""The process in which a precursor cell type acquires the specialized features of a T cell via a differentiation pathway dependent upon transit through the thymus."" [GOC:add, ISBN:0781735149]"
biological_process,skeletal system development,"""The process whose specific outcome is the progression of the skeleton over time, from its formation to the mature structure. The skeleton is the bony framework of the body in vertebrates (endoskeleton) or the hard outer envelope of insects (exoskeleton or dermoskeleton)."" [GOC:dph, GOC:jid, GOC:tb, http://www.stedmans.com/]"
cellular_component,podosome,"""An actin-rich adhesion structure characterized by formation upon cell substrate contact and localization at the substrate-attached part of the cell, contain an F-actin-rich core surrounded by a ring structure containing proteins such as vinculin and talin, and have a diameter of 0.5 mm."" [PMID:12837608, PMID:15890982]"
biological_process,T cell activation,"""The change in morphology and behavior of a mature or immature T cell resulting from exposure to a mitogen, cytokine, chemokine, cellular ligand, or an antigen for which it is specific."" [GOC:mgi_curators, ISBN:0781735149]"
biological_process,positive regulation of apoptotic signaling pathway,"""Any process that activates or increases the frequency, rate or extent of apoptotic signaling pathway."" [GOC:mtg_apoptosis]"
biological_process,cell-cell junction assembly,"""The aggregation, arrangement and bonding together of a set of components to form a junction between cells."" [GOC:ai]"
biological_process,tarsal gland development,"""The process whose specific outcome is the progression of a tarsal gland over time, from its formation to the mature structure."" [GO_REF:0000094, GOC:TermGenie, PMID:20664693]"
biological_process,positive regulation of isotype switching to IgG isotypes,"""Any process that activates or increases the frequency, rate or extent of isotype switching to IgG isotypes."" [GOC:jid]"
biological_process,positive regulation of translational termination,"""Any process that activates or increases the frequency, rate or extent of translational termination."" [GOC:go_curators]"
molecular_function,histone demethylase activity (H4-R3 specific),"""Catalysis of the removal of a methyl group from arginine at position 3 of the histone H4 protein."" [GOC:mah]"
biological_process,liver development,"""The process whose specific outcome is the progression of the liver over time, from its formation to the mature structure. The liver is an exocrine gland which secretes bile and functions in metabolism of protein and carbohydrate and fat, synthesizes substances involved in the clotting of the blood, synthesizes vitamin A, detoxifies poisonous substances, stores glycogen, and breaks down worn-out erythrocytes."" [GOC:add, ISBN:068340007X]"
molecular_function,cyclin-dependent protein serine/threonine kinase inhibitor activity,"""Stops, prevents or reduces the activity of a cyclin-dependent protein serine/threonine kinase."" [GOC:mah, GOC:pr]"
biological_process,neutrophil mediated immunity,"""Any process involved in the carrying out of an immune response by a neutrophil."" [GO_REF:0000022, GOC:add, GOC:mtg_15nov05, ISBN:0781735149]"
biological_process,signal transduction involved in G2 DNA damage checkpoint,"""A signal transduction process that contributes to a G2/M transition DNA damage checkpoint."" [GOC:mtg_cell_cycle]"
molecular_function,RNA polymerase II core promoter sequence-specific DNA binding,"""Interacting selectively and non-covalently with a DNA sequence that is part of the core promoter of a RNA polymerase II-transcribed gene."" [GOC:pg, GOC:txnOH, PMID:12381658]"
biological_process,negative regulation of proteolysis,"""Any process that stops, prevents, or reduces the frequency, rate or extent of the hydrolysis of a peptide bond or bonds within a protein."" [GOC:go_curators]"
biological_process,histone monoubiquitination,"""The modification of histones by addition of a single ubiquitin group."" [PMID:17329563]"
biological_process,maintenance of chromatin silencing,"""The maintenance of chromatin in a transcriptionally silent state such as heterochromatin."" [GOC:mah]"
biological_process,N-terminal peptidyl-lysine acetylation,"""The acetylation of the N-terminal lysine of proteins."" [GOC:ai]"
biological_process,polyubiquitinated misfolded protein transport,"""The directed movement of misfolded polyubiquitinated proteins in a cell, including the movement of proteins between specific compartments or structures within a cell."" [GOC:BHF, GOC:mah, PMID:14675537]"
molecular_function,protein serine/threonine kinase activity,"""Catalysis of the reactions: ATP + protein serine = ADP + protein serine phosphate, and ATP + protein threonine = ADP + protein threonine phosphate."" [GOC:bf]"
biological_process,ATP generation from poly-ADP-D-ribose,"""The process of generating ATP in the nucleus from poly-ADP-D-ribose. Nuclear ATP generation is required for extensive chromatin remodeling events that are energy-consuming."" [PMID:27257257]"
molecular_function,protein methyltransferase activity,"""Catalysis of the transfer of a methyl group (CH3-) to a protein."" [GOC:jl, ISBN:0198506732]"
molecular_function,SUMO binding,"""Interacting selectively and non-covalently with the small ubiquitin-like protein SUMO."" [GOC:mah]"
biological_process,placenta development,"""The process whose specific outcome is the progression of the placenta over time, from its formation to the mature structure. The placenta is an organ of metabolic interchange between fetus and mother, partly of embryonic origin and partly of maternal origin."" [GOC:add, ISBN:068340007X]"
biological_process,maternal process involved in female pregnancy,"""A reproductive process occurring in the mother that allows an embryo or fetus to develop within it."" [GOC:dph]"
biological_process,negative regulation of autophagy,"""Any process that stops, prevents, or reduces the frequency, rate or extent of autophagy. Autophagy is the process in which cells digest parts of their own cytoplasm."" [GOC:dph, GOC:tb]"
biological_process,"CD4-positive, CD25-positive, alpha-beta regulatory T cell differentiation","""The process in which a precursor cell type acquires the specialized features of a CD4-positive, CD25-positive, alpha-beta regulatory T cell."" [GOC:add, PMID:15207821]"
biological_process,histone displacement,"""The removal of histones, including histone dimers, from nucleosomes within chromatin."" [GOC:krc, PMID:15525516, PMID:17496903, PMID:21807128]"
biological_process,negative regulation of cell differentiation,"""Any process that stops, prevents, or reduces the frequency, rate or extent of cell differentiation."" [GOC:go_curators]"
biological_process,negative regulation of lipoprotein lipase activity,"""Any process that stops or reduces the activity of the enzyme lipoprotein lipase."" [GOC:ai]"
molecular_function,protein-succinyllysine desuccinylase activity,"""Catalysis of the reaction: protein-succinyllysine + H2O => protein-lysine + succinate. This reaction is the removal of a succinyl group (CO-CH2-CH2-CO) from a succinylated lysine residue of a protein or peptide."" [GOC:sp, PMID:22076378]"
biological_process,labyrinthine layer morphogenesis,"""The process in which the labyrinthine layer of the placenta is generated and organized."" [GOC:dph]"
biological_process,response to hydroxyurea,"""Any process that results in a change in state or activity of a cell or an organism (in terms of movement, secretion, enzyme production, gene expression, etc.) as a result of a hydroxyurea stimulus."" [CHEBI:44423, GOC:mah]"
biological_process,steroid biosynthetic process,"""The chemical reactions and pathways resulting in the formation of steroids, compounds with a 1,2,cyclopentanoperhydrophenanthrene nucleus; includes de novo formation and steroid interconversion by modification."" [GOC:go_curators]"
biological_process,developmental growth,"""The increase in size or mass of an entire organism, a part of an organism or a cell, where the increase in size or mass has the specific outcome of the progression of the organism over time from one condition to another."" [GOC:go_curators]"
biological_process,nucleosome assembly,"""The aggregation, arrangement and bonding together of a nucleosome, the beadlike structural units of eukaryotic chromatin composed of histones and DNA."" [GOC:mah]"
biological_process,positive regulation of inflammatory response,"""Any process that activates or increases the frequency, rate or extent of the inflammatory response."" [GOC:ai]"
molecular_function,Lys63-specific deubiquitinase activity,"""Hydrolysis of Lys63-Linked ubiquitin unit(s) from a ubiquitinated protein."" [GOC:dph, GOC:pg, PMID:18313383]"
biological_process,regulation of cellular response to drug,"""Any process that modulates the frequency, rate or extent of cellular response to drug."" [GOC:obol]"
cellular_component,nuclear subtelomeric heterochromatin,"""Heterochromatic regions of the chromosome found at the subtelomeric regions of a chromosome in the nucleus."" [PMID:7660126]"
biological_process,negative regulation of smooth muscle cell proliferation,"""Any process that stops, prevents or reduces the rate or extent of smooth muscle cell proliferation."" [CL:0000192, GOC:ebc]"
biological_process,"positive regulation of transcription, DNA-templated","""Any process that activates or increases the frequency, rate or extent of cellular DNA-templated transcription."" [GOC:go_curators, GOC:txnOH]"
biological_process,positive regulation of stem cell population maintenance,"""Any process that activates or increases the frequency, rate or extent of stem cell population maintenance."" [GOC:hjd, GOC:TermGenie, PMID:22969033]"
cellular_component,inclusion body,"""A discrete intracellular part formed of aggregated molecules such as proteins or other biopolymers."" [GOC:mah, PMID:11121744]"
biological_process,ISG15-protein conjugation,"""The covalent addition to a protein of ISG15, a ubiquitin-like protein."" [GOC:mah]"
biological_process,white fat cell differentiation,"""The process in which a relatively unspecialized cell acquires specialized features of a white adipocyte, an animal connective tissue cell involved in energy storage. White adipocytes have cytoplasmic lipids arranged in a unique vacuole."" [PMID:12508945]"
biological_process,locomotory behavior,"""The specific movement from place to place of an organism in response to external or internal stimuli. Locomotion of a whole organism in a manner dependent upon some combination of that organism's internal state and external conditions."" [GOC:dph]"
biological_process,fat cell differentiation,"""The process in which a relatively unspecialized cell acquires specialized features of an adipocyte, an animal connective tissue cell specialized for the synthesis and storage of fat."" [CL:0000136, GOC:go_curators]"
biological_process,motor behavior,"""The specific neuromuscular movement of a single organism in response to external or internal stimuli."" [GOC:bf, GOC:PARL, PMID:25318560]"
molecular_function,bubble DNA binding,"""Interacting selectively and non-covalently with DNA that contains a bubble. A bubble occurs when DNA contains a region of unpaired, single-stranded DNA flanked on both sides by regions of paired, double-stranded DNA."" [GOC:elh, GOC:vw, PMID:16781730]"
biological_process,stem cell development,"""The process whose specific outcome is the progression of the stem cell over time, from its formation to the mature structure. Cell development does not include the steps involved in committing a cell to its specific fate."" [CL:0000034, GOC:isa_complete]"
biological_process,positive regulation of telomerase catalytic core complex assembly,"""Any process that activates or increases the frequency, rate or extent of telomerase catalytic core complex assembly."" [GO_REF:0000058, GOC:BHF, GOC:BHF_telomere, GOC:rph, GOC:TermGenie, PMID:26586433]"
