namespace,name,def
cellular_component,ISWI-type complex,"""Any nuclear protein complex that contains an ATPase subunit of the imitation switch (ISWI) family. ISWI ATPases are involved in assembling chromatin and in sliding and spacing nucleosomes to regulate transcription of nuclear RNA polymerases I, II, and III and also DNA replication, recombination and repair."" [GOC:krc, GOC:mah, PMID:15020051, PMID:15284901, PMID:16568949, PMID:21810179]"
biological_process,regulation of stress granule assembly,"""Any process that modulates the rate, frequency or extent of stress granule assembly, the aggregation, arrangement and bonding together of proteins and RNA molecules to form a stress granule."" [PMID:20180778]"
biological_process,negative regulation of smooth muscle cell migration,"""Any process that stops, prevents, or reduces the frequency, rate or extent of smooth muscle cell migration."" [CL:0000192, GOC:mtg_muscle]"
molecular_function,MutLalpha complex binding,"""Interacting selectively and non-covalently with the mismatch repair complex MutLalpha."" [GOC:vk]"
cellular_component,MLL3/4 complex,"""A protein complex that can methylate lysine-4 of histone H3, and which contains either of the protein subunits MLL3 or MLL4 in mammals, or equivalent in other species."" [GOC:sart, PMID:21875999]"
biological_process,parkin-mediated stimulation of mitophagy in response to mitochondrial depolarization,"""A positive regulation of the macromitophagy pathway that is triggered by mitochondrial depolarization and requires the function of a parkin-family molecule."" [GOC:autophagy, GOC:dph, GOC:pad, GOC:PARL, PMID:25349190]"
biological_process,regulation of RNA polymerase II regulatory region sequence-specific DNA binding,"""Any process that modulates the frequency, rate or extent of RNA polymerase II regulatory region sequence-specific DNA binding."" [GO_REF:0000059, GOC:dph, GOC:krc, GOC:TermGenie, PMID:20026326]"
biological_process,positive regulation of telomere maintenance via telomere lengthening,"""Any process that activates or increases the frequency, rate or extent of telomere maintenance via telomere lengthening."" [GO_REF:0000058, GOC:BHF, GOC:BHF_telomere, GOC:nc, GOC:TermGenie, PMID:23959892]"
cellular_component,nBAF complex,"""A SWI/SNF-type complex that is found in post-mitotic neurons, and in human contains actin and proteins encoded by the ARID1A/BAF250A or ARID1B/BAF250B, SMARCD1/BAF60A, SMARCD3/BAF60C, SMARCA2/BRM/BAF190B, SMARCA4/BRG1/BAF190A, SMARCB1/BAF47, SMARCC1/BAF155, SMARCE1/BAF57, SMARCC2/BAF170, DPF1/BAF45B, DPF3/BAF45C, ACTL6B/BAF53B genes. The nBAF complex along with CREST plays a role regulating the activity of genes essential for dendrite growth."" [GOC:mah, GOC:ss, PMID:17640523]"
biological_process,signal transduction involved in regulation of gene expression,"""Any process that modulates the frequency, rate or extent of gene expression as a consequence of a process in which a signal is released and/or conveyed from one location to another."" [GOC:mtg_signal]"
cellular_component,"RNA polymerase II, core complex","""RNA polymerase II, one of three nuclear DNA-directed RNA polymerases found in all eukaryotes, is a multisubunit complex; typically it produces mRNAs, snoRNAs, and some of the snRNAs. Two large subunits comprise the most conserved portion including the catalytic site and share similarity with other eukaryotic and bacterial multisubunit RNA polymerases. The largest subunit of RNA polymerase II contains an essential carboxyl-terminal domain (CTD) composed of a variable number of heptapeptide repeats (YSPTSPS). The remainder of the complex is composed of smaller subunits (generally ten or more), some of which are also found in RNA polymerases I and III. Although the core is competent to mediate ribonucleic acid synthesis, it requires additional factors to select the appropriate template."" [GOC:krc, GOC:mtg_sensu]"
biological_process,cellular response to estradiol stimulus,"""Any process that results in a change in state or activity of a cell (in terms of movement, secretion, enzyme production, gene expression, etc.) as a result of stimulus by estradiol, a C18 steroid hormone hydroxylated at C3 and C17 that acts as a potent estrogen."" [GOC:mah]"
biological_process,negative regulation of centriole replication,"""Any process that stops, prevents, or reduces the frequency, rate or extent of centriole replication."" [GOC:ai]"
molecular_function,disordered domain specific binding,"""Interacting selectively and non-covalently with a disordered domain of a protein."" [GOC:gg, PMID:11746698]"
molecular_function,double-stranded methylated DNA binding,"""Interacting selectively and non-covalently with double-stranded methylated DNA. Methylation of cytosine or adenine in DNA is an important mechanism for establishing stable heritable epigenetic marks."" [GOC:imk, PMID:17242155]"
molecular_function,histone methyltransferase activity (H4-K20 specific),"""Catalysis of the reaction: S-adenosyl-L-methionine + histone H4 L-lysine (position 20) = S-adenosyl-L-homocysteine + histone H4 N6-methyl-L-lysine (position 20). This reaction is the addition of a methyl group onto lysine at position 20 of the histone H4 protein."" [PMID:12086618]"
biological_process,regulation of apoptotic process,"""Any process that modulates the occurrence or rate of cell death by apoptotic process."" [GOC:jl, GOC:mtg_apoptosis]"
molecular_function,transcription coactivator activity,"""A protein or a member of a complex that interacts specifically and non-covalently with a DNA-bound DNA-binding transcription factor to activate the transcription of specific genes. Coactivators often act by altering chromatin structure and modifications. For example, one class of transcription coregulators modifies chromatin structure through covalent modification of histones. A second ATP-dependent class modifies the conformation of chromatin. Another type of coregulator activity is the bridging of a DNA-binding transcription factor to the basal transcription machinery. The Mediator complex, which bridges transcription factors and RNA polymerase, is also a transcription coactivator."" [GOC:txnOH-2018, PMID:10213677, PMID:16858867]"
biological_process,negative regulation of intracellular estrogen receptor signaling pathway,"""Any process that stops, prevents, or reduces the frequency, rate or extent of the activity of an intracellular estrogen receptor signaling pathway."" [GOC:mah]"
biological_process,ATP-dependent chromatin remodeling,"""Dynamic structural changes to eukaryotic chromatin that require energy from the hydrolysis of ATP, ranging from local changes necessary for transcriptional regulation to global changes necessary for chromosome segregation, mediated by ATP-dependent chromatin-remodelling factors."" [GOC:jl, PMID:12042764]"
biological_process,response to dietary excess,"""The physiological process in which dietary excess is sensed by the central nervous system, resulting in a reduction in food intake and increased energy expenditure."" [GOC:pg, GOC:pr, PMID:12161655]"
molecular_function,peptide butyryltransferase activity,"""Catalysis of the reaction: butyryl-CoA + lysine in peptide = CoA + N-butyryl-lysine-peptide."" [PMID:27105113]"
biological_process,maintenance of protein location in nucleus,"""Any process in which a protein is maintained in the nucleus and prevented from moving elsewhere. These include sequestration within the nucleus, protein stabilization to prevent transport elsewhere and the active retrieval of proteins that escape the nucleus."" [GOC:ai]"
biological_process,DNA demethylation,"""The removal of a methyl group from one or more nucleotides within an DNA molecule."" [PMID:17208187]"
molecular_function,repressing transcription factor binding,"""Interacting selectively and non-covalently with a transcription repressor, any protein whose activity is required to prevent or downregulate transcription."" [GOC:mah, GOC:txnOH]"
biological_process,positive regulation of chondrocyte proliferation,"""Any process that increases the frequency, rate or extent of the multiplication or reproduction of chondrocytes by cell division, resulting in the expansion of their population. A chondrocyte is a polymorphic cell that forms cartilage."" [GO_REF:0000058, GOC:TermGenie, PMID:23212449]"
biological_process,negative regulation of extrinsic apoptotic signaling pathway,"""Any process that stops, prevents or reduces the frequency, rate or extent of extrinsic apoptotic signaling pathway."" [GOC:mtg_apoptosis]"
biological_process,phosphorylation of RNA polymerase II C-terminal domain,"""The process of introducing a phosphate group on to an amino acid residue in the C-terminal domain of RNA polymerase II. Typically, this occurs during the transcription cycle and results in production of an RNA polymerase II enzyme where the carboxy-terminal domain (CTD) of the largest subunit is extensively phosphorylated, often referred to as hyperphosphorylated or the II(0) form. Specific types of phosphorylation within the CTD are usually associated with specific regions of genes, though there are exceptions. The phosphorylation state regulates the association of specific complexes such as the capping enzyme or 3'-RNA processing machinery to the elongating RNA polymerase complex."" [GOC:krc, GOC:mah, PMID:17079683]"
biological_process,positive regulation of translation,"""Any process that activates or increases the frequency, rate or extent of the chemical reactions and pathways resulting in the formation of proteins by the translation of mRNA or circRNA."" [GOC:dph, GOC:go_curators, GOC:tb]"
biological_process,insulin receptor signaling pathway,"""The series of molecular signals generated as a consequence of the insulin receptor binding to insulin."" [GOC:ceb]"
biological_process,peptidyl-serine autophosphorylation,"""The phosphorylation by a protein of one or more of its own serine amino acid residues, or a serine residue on an identical protein."" [GOC:pm]"
biological_process,positive regulation of NIK/NF-kappaB signaling,"""Any process that activates or increases the frequency, rate or extent of NIK/NF-kappaB signaling."" [GOC:TermGenie]"
biological_process,negative regulation of cyclin-dependent protein kinase activity,"""Any process that stops, prevents or reduces the frequency, rate or extent of cyclin-dependent protein kinase activity."" [GO_REF:0000059, GOC:als, GOC:TermGenie, PMID:22995177]"
cellular_component,condensed nuclear chromosome,"""A highly compacted molecule of DNA and associated proteins resulting in a cytologically distinct nuclear chromosome."" [GOC:elh]"
biological_process,respiratory system process,"""A process carried out by the organs or tissues of the respiratory system. The respiratory system is an organ system responsible for respiratory gaseous exchange."" [GOC:dph, GOC:mtg_cardio, GOC:tb]"
biological_process,positive regulation of blood vessel diameter,"""Any process that increases the diameter of blood vessels."" [GOC:pr]"
molecular_function,MutSalpha complex binding,"""Interacting selectively and non-covalently with the mismatch repair complex MutSalpha."" [GOC:vk]"
molecular_function,ISG15 transferase activity,"""Catalysis of the transfer of ISG15 from one protein to another via the reaction X-ISG15 + Y --> Y-ISG15 + X, where both X-ISG15 and Y-ISG15 are covalent linkages."" [GOC:mah, PMID:12826404]"
biological_process,cellular response to angiotensin,"""\""Any process that results in a change in state or activity of a cell (in terms of movement, secretion, enzyme production, gene expression, etc.) as a result of an angiotensin stimulus. Angiotensin is any of three physiologically active peptides (angiotensin II, III, or IV) processed from angiotensinogen.\"""" [GO_REF:0000071, GOC:TermGenie, PMID:22982863]"
molecular_function,H3 histone acetyltransferase activity,"""Catalysis of the reaction: acetyl-CoA + histone H3 = CoA + acetyl-histone H3."" [EC:2.3.1.48]"
biological_process,positive regulation of glucose import,"""Any process that activates or increases the frequency, rate or extent of the import of the hexose monosaccharide glucose into a cell or organelle."" [GOC:ai, GOC:dph, GOC:tb]"
molecular_function,Y-form DNA binding,"""Interacting selectively and non-covalently with segment of DNA shaped like a Y. This shape occurs when DNA contains a region of paired double-stranded DNA on one end and a region of unpaired DNA strands on the opposite end."" [GOC:elh, PMID:16781730]"
biological_process,negative regulation of fatty acid oxidation,"""Any process that stops, prevents, or reduces the frequency, rate or extent of fatty acid oxidation."" [GOC:ai]"
biological_process,regulation of type B pancreatic cell proliferation,"""Any process that modulates the frequency, rate or extent of type B pancreatic cell proliferation."" [GOC:dph]"
biological_process,interleukin-10 production,"""The appearance of interleukin-10 due to biosynthesis or secretion following a cellular stimulus, resulting in an increase in its intracellular or extracellular levels."" [GOC:mah]"
biological_process,protein localization to nucleus,"""A process in which a protein transports or maintains the localization of another protein to the nucleus."" [GOC:ecd]"
biological_process,cellular response to oxidative stress,"""Any process that results in a change in state or activity of a cell (in terms of movement, secretion, enzyme production, gene expression, etc.) as a result of oxidative stress, a state often resulting from exposure to high levels of reactive oxygen species, e.g. superoxide anions, hydrogen peroxide (H2O2), and hydroxyl radicals."" [GOC:mah]"
cellular_component,PeBoW complex,"""A protein complex that is involved in coordinating ribosome biogenesis with cell cycle progression. In human, it is composed of Pes1, Bop1, and WDR12; in Saccharomyces the proteins are known as Nop7p, Erb1 and Ytm1 respectively."" [GOC:ab, GOC:mah, PMID:16043514, PMID:17353269]"
molecular_function,identical protein binding,"""Interacting selectively and non-covalently with an identical protein or proteins."" [GOC:jl]"
biological_process,positive regulation of branching morphogenesis of a nerve,"""Any process that activates or increases the frequency, rate or extent of branching morphogenesis of a nerve."" [GO_REF:0000058, GOC:TermGenie, PMID:16516839]"
biological_process,positive regulation of reciprocal meiotic recombination,"""Any process that increases the frequency, rate or extent of recombination during meiosis. Reciprocal meiotic recombination is the cell cycle process in which double strand breaks are formed and repaired through a double Holliday junction intermediate."" [GOC:dph, GOC:tb]"
biological_process,negative regulation of reactive oxygen species biosynthetic process,"""Any process that stops, prevents or reduces the frequency, rate or extent of reactive oxygen species biosynthetic process."" [GO_REF:0000058, GOC:bf, GOC:PARL, GOC:TermGenie, PMID:24252804]"
biological_process,hair follicle morphogenesis,"""The process in which the anatomical structures of the hair follicle are generated and organized."" [GOC:ln]"
biological_process,positive regulation of histone H4-K20 methylation,"""Any process that activates or increases the frequency, rate or extent of the covalent addition of a methyl group to the lysine at position 20 of histone H4."" [GOC:mah]"
biological_process,regulation of cellular senescence,"""Any process that modulates the frequency, rate or extent of cellular senescence."" [GOC:BHF]"
cellular_component,spindle,"""The array of microtubules and associated molecules that forms between opposite poles of a eukaryotic cell during mitosis or meiosis and serves to move the duplicated chromosomes apart."" [ISBN:0198547684]"
biological_process,heart looping,"""The tube morphogenesis process in which the primitive heart tube loops asymmetrically. This looping brings the primitive heart chambers into alignment preceding their future integration. Heart looping begins with dextral-looping and ends when the main regional divisions of the mature heart and primordium of the great arterial trunks become established preceeding septation."" [GOC:dph, PMID:12094232]"
biological_process,protein localization,"""Any process in which a protein is transported to, or maintained in, a specific location."" [GOC:ai]"
biological_process,positive regulation of vascular endothelial growth factor production,"""Any process that increases or activates the frequency, rate, or extent of production of vascular endothelial growth factor."" [GOC:BHF, GOC:rl]"
biological_process,negative regulation of chromatin silencing,"""Any process that stops, prevents, or reduces the frequency, rate or extent of chromatin silencing."" [GOC:mah]"
biological_process,pharyngeal arch artery morphogenesis,"""The process in which the anatomical structures of a pharyngeal arch artery is generated and organized. The pharyngeal arch arteries are a series of six paired embryological vascular structures, the development of which give rise to several major arteries, such as the stapedial artery, the middle meningeal artery, the internal carotid artery and the pulmonary artery."" [GOC:BHF, GOC:dph, PMID:20122914]"
biological_process,pericentric heterochromatin assembly,"""The assembly of chromatin into heterochromatin that is located adjacent to the CENP-A rich centromere 'central core' and characterized by the modified histone H3K9me3."" [GOC:mah, PMID:20206496, PMID:22729156]"
biological_process,oxidative demethylation,"""The process of removing one or more methyl groups from a molecule, involving the oxidation (i.e. electron loss) of one or more atoms in the substrate."" [GOC:BHF, GOC:mah, GOC:rl]"
molecular_function,ubiquitin-protein transferase activator activity,"""Increases the activity of a ubiquitin-protein transferase, an enzyme that catalyzes the covalent attachment of ubiquitin to lysine in a substrate protein."" [GOC:rb, PMID:18321851]"
biological_process,regulation of chromatin disassembly,"""Any process that modulates the frequency, rate or extent of chromatin disassembly. Chromatin disassembly is the controlled breakdown of chromatin from a higher order structure into its simpler subcomponents, DNA, histones, and other proteins."" [GOC:dph, GOC:tb]"
biological_process,cellular response to glucose starvation,"""Any process that results in a change in state or activity of a cell (in terms of movement, secretion, enzyme production, gene expression, etc.) as a result of deprivation of glucose."" [GOC:jl]"
biological_process,startle response,"""An action or movement due to the application of a sudden unexpected stimulus."" [GOC:dph]"
biological_process,positive regulation of histone H3-K9 methylation,"""Any process that activates or increases the frequency, rate or extent of the covalent addition of a methyl group to the lysine at position 9 of histone H3."" [GOC:ai]"
biological_process,positive regulation of reactive oxygen species biosynthetic process,"""Any process that activates or increases the frequency, rate or extent of reactive oxygen species biosynthetic process."" [GO_REF:0000058, GOC:bf, GOC:PARL, GOC:TermGenie, PMID:24252804]"
biological_process,cleavage furrow formation,"""Generation of the cleavage furrow, a shallow groove in the cell surface near the old metaphase plate that marks the site of cytokinesis. This process includes the recruitment and localized activation of signals such as RhoA at the site of the future furrow to ensure that furrowing initiates at the correct site in the cell."" [GOC:ans, PMID:15811947, PMID:20687468, PMID:2192590]"
cellular_component,transcription factor TFTC complex,"""A protein complex that does not contain either a TATA-binding protein (TBP) or a TBP-like factor, but is composed of several TAFIIs and other proteins, including a histone acetyltransferase. This complex is able to nucleate transcription initiation by RNA polymerase II, can mediate transcriptional activation, and has histone acetyltransferase activity."" [PMID:10373431, PMID:9603525]"
molecular_function,mismatched DNA binding,"""Interacting selectively and non-covalently with double-stranded DNA containing one or more mismatches."" [GOC:mah]"
biological_process,meiotic spindle organization,"""A process that is carried out at the cellular level which results in the assembly, arrangement of constituent parts, or disassembly of the microtubule spindle during a meiotic cell cycle."" [GOC:go_curators, GOC:mah]"
biological_process,lateral ventricle development,"""The process whose specific outcome is the progression of the lateral ventricles over time, from the formation to the mature structure. The two lateral ventricles are a cavity in each of the cerebral hemispheres derived from the cavity of the embryonic neural tube. They are separated from each other by the septum pellucidum, and each communicates with the third ventricle by the foramen of Monro, through which also the choroid plexuses of the lateral ventricles become continuous with that of the third ventricle."" [GO_REF:0000021, GOC:cls, GOC:dgh, GOC:dph, GOC:jid, GOC:mtg_15jun06, ISBN:0838580343]"
biological_process,regulation of stem cell division,"""Any process that modulates the frequency, rate or extent of stem cell division."" [GOC:obol]"
biological_process,steroid metabolic process,"""The chemical reactions and pathways involving steroids, compounds with a 1,2,cyclopentanoperhydrophenanthrene nucleus."" [ISBN:0198547684]"
molecular_function,euchromatin binding,"""Interacting selectively and non-covalently with euchromatin, a dispersed and relatively uncompacted form of chromatin."" [GOC:vw, PMID:22431512]"
cellular_component,juxtaparanode region of axon,"""A region of an axon near a node of Ranvier that is between the paranode and internode regions."" [GOC:BHF, GOC:jl, PMID:10624965, PMID:14682359]"
biological_process,negative regulation of interleukin-17 secretion,"""Any process that stops, prevents or reduces the frequency, rate or extent of interleukin-17 secretion."" [GO_REF:0000058, GOC:bhm, GOC:TermGenie, PMID:16482511]"
biological_process,response to retinoic acid,"""Any process that results in a change in state or activity of a cell or an organism (in terms of movement, secretion, enzyme production, gene expression, etc.) as a result of a retinoic acid stimulus."" [GOC:sl]"
biological_process,regulation of peptidyl-serine phosphorylation,"""Any process that modulates the frequency, rate or extent of the phosphorylation of peptidyl-serine."" [GOC:mah]"
cellular_component,MOZ/MORF histone acetyltransferase complex,"""A histone acetyltransferase complex that has histone H3 acetyltransferase and coactivator activities. Subunits of the human complex include MYST3/MOZ, MYST4/MORF, ING5, EAF6 and one of BRPF1, BRD1/BRPF2 and BRPF3."" [PMID:18794358]"
cellular_component,Swr1 complex,"""A multisubunit protein complex that is involved in chromatin remodeling. It is required for the incorporation of the histone variant H2AZ into chromatin. In S. cerevisiae, the complex contains Swr1p, a Swi2/Snf2-related ATPase, and 12 additional subunits."" [GOC:rb, PMID:14645854, PMID:14690608, PMID:19355820]"
molecular_function,RNA polymerase I CORE element sequence-specific DNA binding,"""Interacting selectively and non-covalently with the regulatory region composed of the transcription start site and binding sites for transcription factors of the RNA polymerase I transcription machinery. This site is often referred to as the CORE element. In mammalian cells, the CORE element functions in conjunction with the Upstream Control Element (UCE), while in fungi, protozoa, and plants, the CORE element functions without a UCE."" [GOC:txnOH, PMID:12865296, PMID:14969726, PMID:8057832]"
biological_process,positive regulation of mitochondrion organization,"""Any process that increases the frequency, rate or extent of a process involved in the formation, arrangement of constituent parts, or disassembly of a mitochondrion."" [GOC:dph, GOC:tb]"
cellular_component,origin recognition complex,"""A multisubunit complex that is located at the replication origins of a chromosome."" [GOC:elh]"
biological_process,heterochromatin organization,"""Any process that results in the specification, formation or maintenance of the physical structure of eukaryotic heterochromatin, a compact and highly condensed form of chromatin."" [GOC:mah]"
molecular_function,aryl hydrocarbon receptor binding,"""Interacting selectively and non-covalently with an aryl hydrocarbon receptor."" [GOC:ai]"
molecular_function,histone deacetylase binding,"""Interacting selectively and non-covalently with the enzyme histone deacetylase."" [GOC:jl]"
biological_process,positive regulation of histone methylation,"""Any process that activates or increases the frequency, rate or extent of the covalent addition of methyl groups to histones."" [GOC:mah]"
cellular_component,SAGA-type complex,"""A histone acetyltransferase complex that acetylates nucleosomal H3 and H2B and is required for the expression of a subset of Pol II-transcribed genes. The budding yeast complex includes the acetyltransferase Gcn5p, several proteins of the Spt and Ada families, and several TBP-associate proteins (TAFs); analogous complexes in other species have analogous compositions, and usually contain homologs of the yeast proteins."" [GOC:mah, PMID:10637607, PMID:17337012]"
biological_process,DNA replication-independent nucleosome assembly,"""The formation of nucleosomes outside the context of DNA replication."" [GOC:mah]"
biological_process,regulation of histone acetylation,"""Any process that modulates the frequency, rate or extent of the addition of an acetyl group to a histone protein."" [GOC:bf]"
